{"bypass_rate":0.225,"configuration_version":"policy-3.3.1","hard_gate_failures":[],"hard_gates_passed":true,"latency_ms":{"median":1.0669500043150038,"p95":1.6726999965612777},"manual_review_rate":0.75,"message_count":40,"metrics":{"assigned_team_exact_match":40,"category_exact_match":40,"category_macro_f1":1.0,"fallback_rate":0.0,"intent_exact_match":39,"model_call_count":0,"priority_exact_match":40,"processing_failure_rate":0.0,"route_exact_match":40,"secondary_intent_precision":0.75,"secondary_intent_recall":0.2727272727272727,"semantic_validity_rate":1.0},"mismatches":[{"actual":"withdrawal_status_first_contact","adjudication_status":"approved_baseline_mismatch","applicable_rule_ids":["INT_WITHDRAWAL_STATUS"],"dataset_name":"supplied-40","expected":"withdrawal_delay","field":"intent","message_id":"M22","reason_codes":["PAYMENT_STATUS_FIRST_CONTACT","INDIA_MARKET_OVERLAY"]}],"run_id":"phase06-supplied-40-evaluation","schema_valid_count":40,"terminal_count":0}
